Title,Price
EvoFox Starter Series Spectre USB Wired Gaming Mouse with Upto 3600 DPI Gaming Sensor | 6 Buttons Design | Upto 7 Million Clicks | 7 Colours Rainbow Lighting with Breathing Effect | 1.5m Braided Cable (Black),379
"ZEBRONICS PHERO Wired Gaming Mouse with up to 1600 DPI, Rainbow LED Lights, DPI Switch, High Precision, Plug & Play, 4 Buttons",199
Razer DeathAdder Essential White Edition - 6400 DPI Ergonomic Wired Gaming Mouse - RZ01-03850200-R3M1,1199
"Logitech G102 USB Light Sync Gaming Mouse with Customizable RGB Lighting, 6 Programmable Buttons, Gaming Grade Sensor, 8K DPI Tracking, 16.8mn Color, Light Weight - Black",1295
Razer DeathAdder Essential Wired Gaming Mouse I Single-Color Green Lighting I 6400DPI Optical Sensor- Black - RZ01-03850100-R3M1,1399
"Razer Bluetooth DeathAdder V2 X Hyper Speed: Award-Winning Ergonomic Design with 16000 DPI - Ultra-Fast Hyper Speed Wireless Ergonomic Gaming Mouse - 235hr Battery Life - RZ01-04130100-R3A1, Black",3442
EvoFox Starter Series Spectre USB Wired Gaming Mouse | Upto 3600 DPI Gaming Sensor | 6 Buttons | Upto 7 Million Clicks | 7 Colours Rainbow Lighting with Breathing Effect | 1.5m Braided Cable (White),379
Ant Esports GM320 RGB Optical Wired Gaming Mouse | 8 Programmable Buttons | 12800 DPI I Ergonomic Design with Braided Cable - Black,549
"Logitech G502 Hero High Performance Wired USB Gaming Mouse, Hero 25K Sensor, 25,600 DPI, RGB, Adjustable Weights, 11 Programmable Buttons, On-Board Memory, PC/Mac - Black",3995
"ZEBRONICS-Transformer-M with a High-Performance Gold-Plated USB Mouse: 6 Buttons, Multi-Color LED Lights,High-Resolution Sensor with max 3600 DPI, and DPI Switch(Black)",399
"Kreo Gaming Mouse with Programmable Buttons & RGB Lighting | Top Pixart Sensor | Adjustable DPI Optical Sensor | Lightweight & Durable (Harpy, Black)",699
EvoFox Blaze Ultra Value 8 Button Programmable Gaming Mouse with 1000Hz Polling Rate | Gaming Grade DPI 200 to 12800 | Ultra-Responsive 7000fps | RGB Lights with Music sync Mode | Windows Software,616
"ZEBRONICS WAR M, Wired Gaming Mouse with 6 Buttons, High Precision Sensor, up to 4200 DPI, Gold Plated USB Interface, Breathing LED, 1.8m Braided Cable",299
Razer Cobra Wired Gaming Mouse: 58g Lightweight Design - Gen-3 Optical Switches - Chroma RGB Lighting with Underglow - Precise 8500 DPI Optical Sensor - 1 - Speedflex Cable - Black-RZ01-04650100-R3M1,3554
Razer DeathAdder V3 Pro Wireless Gaming Mouse- Black : Ultra Lightweight - Focus Pro 30K Optical Sensor - Optical Switches Gen-3 - HyperSpeed Wireless - 5 Programmable Buttons - RZ01-04630100-R3A1,9994
"Logitech G304 Lightspeed Wireless Gaming Mouse, Hero Sensor, 12,000 DPI, Lightweight, 6 Programmable Buttons, 250h Battery Life, On-Board Memory, Compatible with PC/Mac - Black",2395
